{
  "schema_version": "agentflow.project_index.commands.v1",
  "repo": "/fixture/repo",
  "generated_at": "2026-05-11T00:00:00.000Z",
  "commands": [
    {
      "id": "test",
      "kind": "test",
      "command": "npm test -- auth",
      "source": "package.json scripts.test",
      "confidence": "high",
      "scope": ["tests/auth/**"]
    },
    {
      "id": "typecheck",
      "kind": "typecheck",
      "command": "npm run typecheck",
      "source": "package.json scripts.typecheck",
      "confidence": "high",
      "scope": ["src/**", "tests/**"]
    }
  ],
  "missing": [
    {
      "kind": "lint",
      "reason": "No lint script in fixture package."
    }
  ]
}
